event_id,timestamp,affected_type,affected_id,true_delay,true_probability,severity_class,message
sol_r104_e0000,34.10110088854744,edge,"(29, 95)",1.9641329831483856,0.5634833846616085,mild,"slight delay at the crosswalk, nothing serious"
sol_r104_e0001,83.7480601679419,edge,"(9, 1)",1.263648429488628,0.8269120193329956,mild,"minor congestion, moving slowly but flowing"
sol_r104_e0002,192.23074573389167,edge,"(32, 82)",3.1600008094001057,0.8085482972369149,mild,stuck behind a garbage truck for a minute or two
sol_r104_e0003,201.91848688451222,edge,"(97, 66)",2.3363792465219495,0.319519211902368,mild,stuck behind a garbage truck for a minute or two
sol_r104_e0004,207.31525109967745,edge,"(42, 23)",3.004783145725935,0.22423463441779695,mild,"slight delay at the crosswalk, nothing serious"
