event_id,timestamp,affected_type,affected_id,true_delay,true_probability,severity_class,message
svrp_011_e0000,483.7764887063514,edge,"(45, 88)",3.152465901886541,0.40707951094125794,mild,"slight delay at the crosswalk, nothing serious"
svrp_011_e0001,491.5240885567863,edge,"(82, 190)",11.892384926084011,0.8135814911576098,medium,double-parked van blocking half the lane
svrp_011_e0002,541.5708642374481,edge,"(53, 193)",4.0420085532281815,0.8433904293161018,mild,stuck behind a garbage truck for a minute or two
svrp_011_e0003,644.779075214712,edge,"(103, 130)",7.587831713965497,0.8515790740094155,medium,"construction work narrowing the lanes, slow but moving"
svrp_011_e0004,912.1890322177824,edge,"(125, 178)",9.26118902786089,0.7038976214219262,medium,"school zone congestion, queues forming"
