event_id,timestamp,affected_type,affected_id,true_delay,true_probability,severity_class,message
svrp_008_e0000,101.5284098706151,edge,"(32, 26)",5.449310764582302,0.7130635361878613,medium,"school zone congestion, queues forming"
svrp_008_e0001,172.6463908179218,edge,"(87, 57)",1.8137059589233082,0.5530446910110868,mild,"minor congestion, moving slowly but flowing"
svrp_008_e0002,615.1114606948274,edge,"(7, 77)",6.107304885940913,0.6888876282577683,medium,"construction work narrowing the lanes, slow but moving"
svrp_008_e0003,815.9080438412291,edge,"(66, 39)",3.1973497538460407,0.5364396098196308,mild,stuck behind a garbage truck for a minute or two
svrp_008_e0004,1388.2487716925307,edge,"(34, 12)",5.493725643410636,0.8360756837080006,medium,"school zone congestion, queues forming"
