event_id,timestamp,affected_type,affected_id,true_delay,true_probability,severity_class,message
syn_n100_000_e0000,46.36092989230802,edge,"(76, 41)",1.8075716139714262,0.14446613971895783,mild,"slight delay at the crosswalk, nothing serious"
syn_n100_000_e0001,132.81729734868708,edge,"(45, 78)",8.091007357473151,0.22550624976878975,medium,double-parked van blocking half the lane
syn_n100_000_e0002,156.50797168287264,edge,"(27, 93)",1.10292351586567,0.4343130027325207,mild,stuck behind a garbage truck for a minute or two
syn_n100_000_e0003,198.09207755919823,edge,"(51, 99)",6.263765299445962,0.3552149912977994,medium,"construction work narrowing the lanes, slow but moving"
syn_n100_000_e0004,439.39270028742294,edge,"(94, 84)",6.998942012097653,0.530907298549711,medium,"school zone congestion, queues forming"
